{"$schema":"https://json-schema.org/draft/2020-12/schema","$id":"https://recrafts.local/contracts/package-lineage.schema.json","type":"object","additionalProperties":false,"required":["event_id","event_type","package_id","parent_package_id","restored_from_package_id","correction_ids","decision_ids","created_at","artifact_set_hash"],"properties":{"event_id":{"type":"string","pattern":"^lineage-"},"event_type":{"enum":["extracted","corrected","accepted","rollback-created"]},"package_id":{"type":"string"},"parent_package_id":{"type":["string","null"]},"restored_from_package_id":{"type":["string","null"]},"correction_ids":{"type":"array","items":{"type":"string"}},"decision_ids":{"type":"array","items":{"type":"string"}},"created_at":{"type":"string"},"artifact_set_hash":{"type":"string","pattern":"^[a-f0-9]{64}$"}}}
