{
  "event_id": "lineage-c4c8128c92109135",
  "event_type": "accepted",
  "package_id": "package-4192c75f3227ddb5",
  "parent_package_id": "package-a773edead6a47370",
  "restored_from_package_id": null,
  "correction_ids": [
    "correction-r010-owner-pass-20260716",
    "correction-r010b-metadata-finalization-20260716"
  ],
  "decision_ids": [
    "decision-r010-owner-pass-20260716",
    "decision-r010b-independent-review-accept-20260716"
  ],
  "created_at": "2026-07-16T13:05:00+08:00",
  "artifact_set_hash": "86d3a86c3cc1ad99c2f0e9363d0b294a42d2eb7bd3c219217e520fab88a9ebbf"
}
